{
  "schemaVersion": 2,
  "schemaRef": ".engifoundry/contracts/executors.schema.json",
  "configured": false,
  "executor": null,
  "reviewer": null,
  "gate": {
    "executorUnavailable": {
      "action": "ask-user",
      "fallbackTarget": "current-session",
      "decisionScope": "task"
    }
  }
}
